author,body
MUSTANG,#BuyLocal \n#BuyUSA\n#StopChina\n\nStop buying Chinese stocks\nSTOP funding a government that wants to destroy our way of life. \n\n#Amazon\nNeeds to tell people where the product is made &amp; coming from\n\n#Government\nStock using China to pump their prescriptions to US citizens.\n\n#Fentynal
Free Tibet,"Beijing claims to bring 'development' to Tibet, but what have we gained? Surveillance, arrests, stolen land, and destroyed monasteries. This is not progress—it’s cultural genocide! #SaveTibet #StopChina"
kinnoro motoyuki,"Look at the map of the so-called South China Sea, technically it is wrong to call it a South China Sea, rather it should be called the South East Asian Sea because it shares boundaries with those countries. 1/4\n#StopChina \n@JP_Quest @skyscraperfff  @TommyBaxendale @JILL69693 https://t.co/mjxAeUywF1"
Bhasundara,"Beijing built walls, not bridges.\nTibetans don’t want digital surveillance, they want dignity.\nNo algorithm can predict a revolution that begins in the soul.\n#FreeTibetNow #StopChina https://t.co/lXod5xV4r8"
titi,#BoycottChina\n#MadeinChina\n#StopChina
KaigaiSumi,"世界経済に大打撃:すでに懸念され始めた🇺🇸🇮🇷イラン紛争ホルムズ海峡の次🇨🇳中国による台湾海峡封鎖 #StopChina\nそして&lt;台湾有事に米軍は介入しないだろう&gt;😱Romuald Sciora, IRIS\nBFM Business📺France https://t.co/QTfJNK70v4"
Chinese Pulse,"Beijing pretends to “champion free trade” in Lesotho while flooding poor nations with loans they can’t repay. Same old tactic: offer help, then own the resources &amp; ports! #ChinaAfrica #DebtColonialism #StopChina\n\n https://t.co/d7kIndYYid https://t.co/3wwXxRx1iv"
Chinese Pulse,"The Chinese regime’s repression has no borders. From East Turkestan to Europe, silencing voices that speak for Uyghurs only exposes Beijing’s fear of truth. The world must stand with the victims, not the perpetrators. #StandWithUyghurs #HumanRights #StopChina"
Zaroon Khan,"Why’s the CCP flag waving at the #NoKings rally? \n\nOhh, My bad—China’s orchestrating it all, stoking Middle East wars and undermining U.S. democracy from within. The dragon’s playing a cunning game! #StopChina #SayNoToWar #IranvsIsrael \n@NoCCPGenocide \n@hongkongishere https://t.co/bTfE9MSUku"
Be2BeClub,"Pendant qu'on voit la petite chicane entre le Canada et USA.\n\nLa société minière #AlliedGold basée à Toronto a accepté cette semaine une prise de contrôle en espèces de 5,5 milliards de dollars par la société chinoise #ZijinGold du PCC !! \n\n#stopchina #stopppc #stopislam #Canada https://t.co/2I1wU2tNVn"
Lim Kong,The Chinese regime’s use of AI for cyberattacks is a sinister tool of  control and oppression. We cannot allow their digital warfare to  undermine global peace and security. #StopChina
Muhammad Amirul,"Internal matter of China? how? Taiwan is an independent sovereign nation, and China is different. How can you claim such irresponsible intention, even if it were not meant seriously? 1/3\n\n#Taiwan #StopChina #BoycottChina \n\n@HKokbore @Maggie9993 @No_More_China https://t.co/b49hptwx0R"
Stanzin,"China’s Dam Diplomacy!\nBulldozing #Tibet’s ecology with a $167B mega-dam, Beijing plays god with Brahmaputra, risking millions of lives in India &amp; Bangladesh. \n#StopChina #FreeTibet\n\nChina Advances $167 Billion Tibetan Mega-Dam Despite Risks\nhttps://t.co/nWPc9HLcBq"
二代目うんとこ師匠,#worldnews\n#stopChina
Bhasundara,"China is erasing Tibet’s culture—forcing Mandarin in schools, banning Buddhist teachings, and making Tibetans strangers in their own land. This is cultural genocide! 🚨 #StopChina https://t.co/2VKxlopJde"
titi,Putos chinos retrasados mentales están bien idiotas 😡🇨🇳😡😡🇨🇳😡\n#Boycottchina\n#Madeinchina\n#Stopchina
Dave Spurlock,.We can protect Qatar (who is a terrorist haven for the likes of Hamas leaders and Muslim Brotherhood) but we can’t issue a similar position on Taiwan?  @POTUS please formally recognize Taiwan as an independent Nation! #StopChina
titi,Horribles desde chiquitos malditos chinos \n#Boycottchina\n#Madeinchina\n#Stopchina\n😡🇨🇳😡🇨🇳😡🇨🇳😡🇨🇳😡🇨🇳
47 is in the house!,Chinese academics at top U.S. schools and labs were part of CCP’s infamous Thousand Talents Program\n#StopChina https://t.co/DT0M5biyrU via @JustTheNews
titi,Malditos porque tienen tanta pinche ira y la desquitan con los Animales los hdspm a lo mejor porque están horribles los malditos chinos 😡🇨🇳😡🇨🇳😡🇨🇳😡🇨🇳😡🇨🇳\n#Boycottchina\n#Madeinchina\n#stopchina\n#XiJinping
Muhammad Amirul,"China is trying to interfere in Taiwan's democracy, Reuters reports. China should stop interfering in the internal affairs of Taiwan. \n\nWhat if Japan interferes in the appointment of the CCP leaders in China? 1/3\n\n#StopChina #Taiwan \n\n@HKokbore @Maggie9993 @No_More_China https://t.co/ZKNlbUL53x"
titi,#StopChina\n#MadeinChina\n#Boycottchina
Grito Animal Rio de Janeiro,"Grito Animal junto com varios outros grupos unidos contra o Festival de Yulin que acontece na China todos os anos entre 21 à 30 de julho, onde são mortos mais de 15 mil cães e gatos para a gastronomia do festival.\n\n#stopyulinforever #stopchina #yulin #stopyulin https://t.co/yHTrl6kSSK"
Dee Enn,"China says it’s combating terror, but Uyghur children locked in orphanages, parents jailed in camps—our culture erased piece by piece. #UyghurGenocide #StopChina https://t.co/JL48uEXAeE"
Bhasundara,Children in Tibet are being separated from families and put into state-run “boarding schools” for indoctrination.\nThis is forced assimilation — and it's happening now.\n#StopChina #FreeTibet https://t.co/v5vhluYWB0
titi,Malditos chinos \n#Boycottchina\n#Madeinchina\n#Stopchina\n#XiJinping
evap,#STOPCHINA\n#STOPRUSSIA
KaigaiSumi,憲法「いらうな」???👈こんな意味不明の書き間違いは日本人ならありえないとワタクシ思うのデス😳\n🇫🇷🗾在住のジャーナリストさま動画👇&lt;多くの日本人が平和憲法改正に抗議デモ&gt;と伝えてらっしゃるけれども\n#StopChina #スパイ防止法 #通名制度廃止 \n#北朝鮮送金禁止 #北朝鮮学校閉鎖 #StopRussia https://t.co/jSZIik58Ov
ACARA,"While China wants to show the world its efficiency in technology, in labor, and by showing that it plants trees, the truth is that it is a country that allows animal cruelty and violence Those who fight for animal welfare and against crime are repressed and threatened #StopChina"
AT_XQ,"🚨 BREAKING: Trump Hits Back at China – “Massive” Tariffs Incoming on All Products Flooding U.S. Borders! 🇺🇸💥🇨🇳\nThis builds on his bold 10% baseline tariffs already in effect, with threats up to 30%+ to force real action.#AmericaFirst #StopChina #Trump2025"
Ling Yun (灵韵),China’s labs = surveillance weapons.\nUS universities = enablers.\nUyghurs = victims.\n#StopChina #UyghurGenocide #HumanRights \nhttps://t.co/miN73u5Akn
ACARA,They weren't born for this.\nIt's not culture.\nIt's not tradition.\nIt's cruelty.\n\nAnd silence kills too. 🐾\n@AdhikaPrapti @AraceliPantoj17\n@PhaedraXTeddy @almanimal2019 @animals_cn\n#BoycottChina #StopChina #StopAnimalCruelty #SeresSintientes #ProteccionAnimal https://t.co/ycoDBqOC4z
Ling Yun (灵韵),Tibetan abbot 🙏 Chogtrul Dorjeten taken away in Qinghai. His school closed. No reason given.\n#StandWithTibet #HumanRights #StopChina\nhttps://t.co/7Y0j6wBcLH
ACARA,"A cat abuser lives in Tokyo, Japan, passing on the information. He's a danger to all cats. \n@samesama03 @samesama4149224 @Alejo_23Esp @AmanthiRan4 @PhaedraXTeddy @NamiKim_DogsSK @EsEstra @NadiaMo33 @FGuardiansJapan @WeAreNotFood \n#BoycottChina #StopChina #stopanimalcruelty"
紫陽花,同意致します。\n侵略者追放✊\n\n#StopCCP \n#StopChina
चेतना उपाध्याय: /Chetana Upadhyay,"Over 1 million Tibetan children are cut off from family, faith, and language in colonial boarding schools. This is not education, it’s ethnic cleansing.\n#StopChina #FreeTibet #GetOutChina \nhttps://t.co/eSC8eSRBW6"
Saad Ibrahim,"The CCP regime has taken mostly men of the society to the concentration camps, while women are trying to keep everything in place, looking after everything. 1/4\n\n#FreeUyghurs #StopChina #Chineseimperialism \n\n@swim_shu @manchuriareview @care_crisis https://t.co/L2p3MvkpAb"
ACARA,"The stupidity of human beings at its finest, people who are trash and should disappear from this world.Then human beings get scared by natural disasters but they forget the harm they cause to others. \n#BoycottChina #StopChina #stopanimalcruelty #stopanimalabuse"
The #AmericanDC,245
ACARA,If this is done by those who are supposed to protect and maintain order.\nHe is nothing more than a psychopath and Chinese society has many torturers and murderers.\nSign the petition and share it\nThis seems to have no end 😞\n#stopanimalcruelty #BoycottChina  #StopChina
titi,Malditos chinos HDSPM todos hablan del petróleo que roba Estados Unidos pero nadie habla de todo lo que hacen los putos chinos que maman todos los recursos naturales por mar y tierra! 😡😡 Y aún así vienen a adueñarse dMéxico con sus negocios\n#Boycottchina\n#Madeinchina\n#stopchina
Tuba elver,"Dünyaya covid saldınız. Binlerce insan sizin kedi köpek yemenizden öldü,lanetliler..\n#stopchina #animalsright #COVIDー19 #eatnodogcat #murder #STOPYULIN2025"
Ling Yun (灵韵),A Uyghur activist who exposed China’s abuses is jailed in New York instead of protected. Deportation risks sending him back into the regime’s claws 🐉 \n#StopChina #UyghurRights\nhttps://t.co/5PtGSHxoFo
Michael J Marsh,"How about we direct our efforts towards non-carbon sources of energy, which exist in the forms of nuclear &amp; water driven generation, and stop with the grifting guilt trip that 'climate change' being caused by middle aged folks driving Suburbans and F250s. #stopchina @elonmusk https://t.co/ZGNl1Jofjz"
ACARA,"What can you expect from psychopaths?\nChina is a country of savages and torturers, where good people suffer hell with the cruelty that animals endure.\n#BoycottChina\n#StopChina #StopAnimalCruelty"
ACARA,"Another little girl was saved from torture in #China, where psychopaths abound.\nThey may have advances in technology, but in values, respect, and ethics, they are backward. They live to torture and murder defenseless and vulnerable beings.\n#BoycottChina #StopChina"
Tuba elver,Zulüm \nStop the china  #yulinmurder #animalsright @stop the killing \n#stopchina
Ling Yun (灵韵),Tibetans in Kashi village protested illegal mining. China responded with door-to-door arrests and torture 😠 \n#StopChina #GoldValley #HumanRightsDay \nhttps://t.co/R2EL11xjfn
Samuel Bell,"A few CCP loyalists, little pink might crumble after seeing just how deeply Taiwan rejects their regime. 1/4\n#StopChina #StopInterference \n\n@celikturkcu @isaac_cychiu\n@massan_jc  @That_isChina @Midnightcause @HKokbore @hongkongishere https://t.co/jFfpKLTXLI"
Alfredo,#Argentina #USA #StopChina
evap,#STOPCHINA
Katie Anderson,"Once again, another provocation by the PLA against Taiwan.\nIncursions, threats, and military drills, this isn’t routine posturing. It’s the slow march toward war. #Taiwan #StopChina 1/3 @HKokbore @TravelGuyAsia @IndoPac_Info @Redphoo1 https://t.co/2uiNKaWo2O"
Siyaset ve Strateji,📌🔴Attığı gol ile Türkiye'nin Dünya Kupası'na katılmasını sağlayan Kerem Aktürkoğlu'nun daha önceki bir paylaşımı gündeme geldi.. \n\n#millitakım #DoğuTürkistan #stopchina #uyghur #uygur https://t.co/DfISHTNlzj
AY- HAN REIS,#stopyulin #stopchina #aanimalabuse
Mark C,THIS IS SPOT ON!! #StopChina\n\nThe CCP Is America’s Enemy—and It’s Time to Act Like It https://t.co/U2A9fzN1Xl via @epochtimes
titi,Chino desgraciado lo vas a pagar\n#Boycottchina\n#madeinchina\n#Stopchina
Müteşekkiriyet,Çin'in işkence kamplarında insanlar inançları yüzünden yok ediliyor. Sen sessizken zulüm sürüyor. #FreeUyghurs #StopChina #DoğuTürkistan
titi,Ni una clase de animalito se salva con estos asiáticos de mierda!\n#Boycottchina\n#MadeinChina\n#StopChina 🇨🇳🤬🇨🇳🤬🇨🇳🤬🇨🇳🤬\nhttps://t.co/Y63iuNIqqw
ACARA,"What I said, people sick with violence, a danger to the rest of the countries and our animals \n#StopAnimalCruelty \n#BoycottChina \n#StopChina \n#AltoChina\n#LaCreacionDeDiosSeCuidaYSeRespeta  #SinViolencia"
ACARA,"Asian networks should be shut down for content about animal torture and murder, which shows a society sick with violence and is full of psychopaths. \nThis is really sickening \n#BoycottChina #StopChina #StopAnimalCruelty #AltoChina"
ACARA,"The torture and murder of animals in China is unprecedented, and the labels used by psychopaths speak volumes about the scum they are.\n#China has no honor nor does it follow the principles of Confucianism.\n#StopChina\n#BoycottChina \n#StopAnimalCruelty"
ACARA,A massive rescue of 300 innocent souls by activists who give everything to save them 🙏🙏🙏\n#BoycottChina #StopChina #StopAnimalCruelty
ACARA,These people are the scum of the world and are making hell for animals and for those of us who seek to end animal cruelty.\nIt's so sad to know this woman is dragging this beautiful kitten and it will end up killed.\n#BoycottChina #StopChina #StopAnimalCruelty
ACARA,How is it possible that they do not intervene and allow these psychopaths to kill all these little animals? \nWhat kind of monsters live in #China and the government is complicit in such atrocities?\n#BoycottChina #StopChina #stopanimalcruelty
Sabri DÜNDAR,#uyghurgenocide\n#stopchina\n#freeuyghurs
ACARA,Rescatado del comercio de carne tendrá una vida como la que merecen cada animal torturado y asesinado por psicópatas \n#stopanimalcruelty #BoycottChina #StopChina
yücel  tanay,"""\""Abdülmelik Mijit detained in Sefaköy police raid"
titi,Enfermedad? Si su nación ya está en decadencia cuando pagan por ver cómo torturan animales! Malditos chinos se quieren dar baños de pureza cuando son una 💩💩💩\n#Boycottchina\n#Madeinchina\n#Stopchina https://t.co/v3lTEUY23g
titi,Chinos de mierda 😡🇨🇳😡 mierda 💩🇨🇳😡🇨🇳💩😡🇨🇳💩🇨🇳😡💩😡🇨🇳\n#Boycottchina\n#Madeinchina\n#Stopchina
titi,Chinos de Mierda tienen mierda en la cabeza asquerosos! 😡😡\n#Boycottchina\n#Madeinchina\n#Stopchina
titi,Los malditos asiáticos tienen mierda en la cabeza 😡🇨🇳😡🇨🇳\n#Boycottchina\n#Madeinchina\n#Stopchina\n#XiJinping
ACARA,All animals in the hands of abusers in China suffer\n#BoycottChina #StopChina #StopAnimalCruelty
ACARA,This is hell for both the animals and the activists we should support in various ways. This cannot continue like this. What kind of world will we leave behind?\n#BoycottChina #StopAnimslCruelty #StopChina
ACARA,"Psychopaths who teach their children to continue abusing, torturing, and murdering animals. The international community must continue to speak out and support Chinese activists.\nApply pressure to ban, formulate protective laws and enforce them. \n#StopAnimalCruelty #stopchina"
Yosef Cohen,Buying oil from Tehran while ignoring warnings? That’s playing with fire on the global stage.1/5\n#StopChina \n\n@yuceltanay53  @ECOAlphaTango @ev_edward2 https://t.co/RfARMja3vO
ACARA,"Scenes like this seem like something out of a horror movie, but this is what thousands of animals experience at the hands of torturers and murderers in #China. \nStop buying Chinese products, they sell them cheaper but they are of poor quality, do not help this happen \n#StopChina"
ACARA,"Is this true in China? If so, where do they allow this savagery? Is this country full of abusers and torturers? We feel so sorry for the good citizens who love animals.\n@PhaedraXTeddy @AmanthiRan4 @HgPZKypleR61580 @WeAreNotFood @DogsofYulin @PawsofChina @NadiaMo33 \n#StopChina https://t.co/0DVb6LHlcz"
🇹🇷 🐺𐱅𐰼𐰇𐰰 🐺🇹🇷,ÖZGÜR DOĞU TÜRKİSTAN…!\n#FreeUyghurs \n#Freeuyghur \n#Stopchina https://t.co/s1OJmqgAuA
Emre T.,Doğu Türkistanda kardeşlerimize yapılan zulme dur diyoruz!\n\n#StopChina
Xiang 翔,"""China's Shi Taifeng tours Gansu &amp; Sichuan to push \""Sinicization\"" of Tibetan Buddhism—forcing monks to pledge loyalty to the CCP over Dalai Lama. Cultural genocide in plain sight. #StopChina #FreeTibet #ChinaLies\nhttps://t.co/oNtqmgGx1x"""
South China Sea Insights,"China’s push to “develop” 11,000 islands is blatant militarization disguised as governance. Artificial bases threaten peace, resources, and sovereignty across Asia. #SouthChinaSea #StopChina https://t.co/hCaavn2hcQ"
Xiao Bao (小宝),"China’s bid to “build up” 11,000 islands is nothing but aggressive expansion cloaked in governance. Artificial bases, militarization, and resource grabs threaten regional peace. #SouthChinaSea #StopChina   https://t.co/Gw3fWQekfE https://t.co/Ya3VI1MRx5"
KaigaiSumi,🥳👏\nこれに反対しているのは&lt;中国勢力だけ&gt;#StopChina\n\n今回の日本の防衛装備品海外輸出の正当性を示しているかと👏
KaigaiSumi,@afpbbcom 旧宗主国のアフリカ植民地支配続く~などと露中のプロパガンダを信じていた人々にも👇政権を汚職で抱え込み、現地の人々を搾取しているのは、中国であることが、ご理解いただけるかと存じます #StopChina https://t.co/mFlmqD9fBs
T sibaken,"@lico337 China violates international rules daily, yet you stay silent. Go hold your rallies at the Chinese Embassy! Tell the aggressor to stop the war, not us. Show some consistency for once. #StopChina #XiJinping"
Just A Humble Reader,@JoelTheDane @Tuffen78 So it is a 🇷🇺&amp;🇨🇳 war against Ukraine now.\n#Stoprussia\n#Stopchina \n#UkraineInNATO https://t.co/nlmnnjk0uc
inci,Bu insanların sesi olmak için yeterince çabalamıyoruz. Bu çocuklar bizim çocuklarımız da olabilirdi #doğutürkistan #uygur #stopChina
titi,"@Albertico2020CC @desdebalcon @mariabages1 @PROFEPA_Mx China! jajaja exige todo eso para torturar todo tipo de Animales y ganar dinero con su contenido, no pues que gran paso dio china! mientras que los animalitos se chinguen si tienen un  título no hay problema! 🇨🇳 \n#stopchina\n#ChinaEvil\n#Boycottchina"
KaigaiSumi,感情論ではなく、データや数字で理論的に検証なさる🇯🇵若者たち👏尊敬いたします\n&lt;少数民族&gt;や&lt;言語&gt;を理由に国内分裂を起こすのが昔も今も侵略側が使う手 #StopChina #StopRussia
Voice of Uyghurs(维吾尔人之声),"China is locking up millions of Uyghur people in camps, forcing them to work and forget their culture. This is wrong! Stand with Uyghurs and demand freedom. #FreeUyghur #UyghurGenocide #StopChina\nhttps://t.co/07bk43CSt6"
titi,Malditos Asiáticos horribles HDSPM 😡😡 \n#Boycottchuna\n#Madeinchina\n#StopChina
KaigaiSumi,@K72537632 @w2skwn3 通貨の力は国力\n🇺🇸ドルが弱くなり\n🇨🇳Yuan人民元(武力で国境を書き換える勢力の親玉)が強くなっている＝🇨🇳勢力圏拡大\nそれは🇯🇵🇺🇦など脅威国の近接諸国にとって危惧することでございます #StopChina\n\n🇮🇷もYuanを使い始める👇🇫🇷l'opinion26/03/2026\nhttps://t.co/jR0odaybN2
KaigaiSumi,"中国🇾🇪テロ組織フーシと交渉し原油調達中\n#StopChina #Iran #StopTrump\n今はテスト段階\nだからアデン湾を通過する🇨🇳🚢は少ない\nしかしお試し期間を経て\n🇨🇳＆フーシ連携が本格的になると\n西欧をはじめ世界にとって大惨事😱\n🇫🇷François Godement,👇モンテーニュ研究所アジア米国担当特別顧問 https://t.co/AK6lqrOJqH"
KaigaiSumi,@RusEmbassyJ 軍拡し続けている侵略国たち👇から防衛するためです\n#StopRussia #StopChina #北朝鮮送金禁止 #北朝鮮学校閉鎖\nロシアは使用通過がルーブルから中国通貨になってすっかり中国属国です\n隣国カザフスタンの民間両替商もルーブルを拒否するほど https://t.co/HmcysTlBas
KaigaiSumi,🇨🇳中国はディアスポラ(海外にいる同胞約100000人)を諜報その他に使います\n報酬でダメなら家族を使って脅します\n#StopChina #StopRussia #スパイ防止法 #通名制度廃止 #北朝鮮学校閉鎖\n良い🇨🇳友人がスパイにならない保証はございません https://t.co/1PniM66ZPv
KaigaiSumi,🇯🇵🇫🇷🥳宇宙は重要な戦略的課題\n🇫🇷宇宙軍司令官のシュソー空軍少将\n東京で🇯🇵高官数名それから航空自衛隊宇宙作戦本部の府中基地✈️で広之大佐と会談\n#StopChina #StopRussia #スパイ防止法 #通名制度廃止 #北朝鮮学校閉鎖
KaigaiSumi,"しかし\n今ウクライナ侵攻中ロシアの小村のおばあさんが&lt;戦争はいやだけど🇺🇦民を&lt;救うため&gt;だから仕方ない&gt;とわたしの親戚と同じ発言を🇫🇷ドキュメンタリーでしていました\n\n洗脳されない,だから&lt;報道の自由&gt;が平和には一番必要だと思う次第です\n#StopChina #StopRussia #スパイ防止法 #北朝鮮学校閉鎖"
KaigaiSumi,イランが指導者を失っても米と戦い続けられる理由\n数年前から準備されていた\n分散型システム&lt;モザイク戦略&gt;\n頭が落ちた瞬間から🇮🇷全土に分散する戦闘グループが自律的に戦闘を行う\nRobert A. Pape 政治学者🇺🇸シカゴ大教授\n#Iran #StopChina #スパイ防止法 #StopTrump #StopRussia https://t.co/pro5bpIaaX
titi,@chngunjn11 @HgPZKypleR61580 @TopuzzoC @SCMPNews Malditos asquerosos asiáticos por eso están horribles los hdspm 😡 \n#BoycottChina\n#MadeInChina\n#StopChina
KaigaiSumi,まともなご意見が🇯🇵にもあって安心しました\n#Iran #StopRussia #StopChina\n&lt;ロシアのウクライナへの要求には「非ナチス化」が含まれていた。ウクライナは「ナチス国家」ではなく、根拠のない主張だ&gt; 👏\n小泉悠さま&lt;現代戦争論&gt;\nhttps://t.co/EYQQAD79sM
KaigaiSumi,"#Iran #StopRussia #StopChina\n🇯🇵大手報道💕🇨🇳🇷🇺🇰🇵という印象ですね\n文藝春秋🇷🇺プーチンのオウム🇫🇷トッドを招待\nhttps://t.co/qEgvti1bCw\n\n🦜Toddは&lt;西側の敗北&gt;の中で\n🇺🇦と西欧の終焉を,\nまともな議論もなく,\n首尾一貫することもなく,\n🇷🇺プロパガンダに沿って宣言している\n🇫🇷LeMonde 2024/01/19"
KaigaiSumi,"外国にも中国の反日政策が周知となり👇良いことでございます #StopChina #スパイ防止法 #通名制度廃止  #北朝鮮送金禁止 #北朝鮮学校閉鎖 \n🇫🇷lexpress📚03/2026\n15年前,数か月にわたり,北京は,特に原発の処理水の海洋放出を問題視するなどして日本に対する大規模なデマキャンペーンを展開した"
KaigaiSumi,🇫🇷フランス軍参謀総長\nウクライナの勇猛さは称賛に値します\n私たちは🇺🇦軍への支援をこれまで以上に断固として行い、引き続き彼らと連帯していきます👏\n#StopRussia #Iran #StopChina #スパイ防止法 #通名制度廃止  #北朝鮮送金禁止 #北朝鮮学校閉鎖 #StopTrump
KaigaiSumi,#StopChina 🇫🇷報道によると&lt;無差別&gt;ではなく🇺🇸AIに入れた土地データが古かった/昔はIran軍組織があったゆえの&lt;誤爆&gt;\n\n中国はイラン産原油の約80％を購入している\n📺BFM🇫🇷14/03/2026\n中国＝イラン自国民虐〇軍隊と外国テロ組織の間接的な資金源\n@hugodecrypteactus🇫🇷13/03/2026
KaigaiSumi,イランに軍事協力している中国 #StopChina\nだから中国籍石油タンカーは、ホルムズ海峡を今も無事に通過できています\n#スパイ防止法 #StopIran #通名制度廃止  \n#北朝鮮送金禁止 #北朝鮮学校閉鎖 #StopRussia https://t.co/q7QQlcdMle
KaigaiSumi,🇺🇦👏🙏#StopChina #スパイ防止法 #通名制度廃止\n#北朝鮮送金禁止 #北朝鮮学校閉鎖 #StopRussia \nhttps://t.co/gpta1Ghbbs
KaigaiSumi,#StopChina #スパイ防止法 #通名制度廃止 \n#北朝鮮送金禁止 #北朝鮮学校閉鎖 #StopRussia
titi,#Boycottchina\n#Madeinchina\n#Stopchina\n🇨🇳😡🇨🇳😡🇨🇳😡😡🇨🇳😡🇨🇳😡
KaigaiSumi,@ChnEmbassy_jp 過去半世紀にわたり国民を虐〇してきたイランに軍事力提供している自国を恥におもって習近平共産党を打倒してくださいませ #StopChina\nhttps://t.co/1nv6PLLVIi
KaigaiSumi,#StopRussia🇪🇺欧州委員会はロシア産石油に対する制裁を緩和する案を&lt;却下&gt;👏\n対露&lt;最大限の圧力&gt;を&lt;維持する&gt;よう呼びかける👏\nひとまず安心ホッ今年こそ解決したい🇺🇦 #Iran #StopChina
titi,#Boycottchina\n#MadeinChina\n#StopChina\n😡🇨🇳😡🇨🇳😡🇨🇳😡🇨🇳😡🇨🇳😡🇨🇳
titi,#Boycottchina\n#MadeinChina\n#Stopchina\n#ChinaEvil\n😡🇨🇳😡🇨🇳😡🇨🇳😡🇨🇳😡🇨🇳😡🇨🇳
tenzin,March 10 is now a global day of Tibetan solidarity—peaceful protests and calls for justice expose the CCP’s ongoing violations inside Tibet.\n#JusticeForTibet #StopChina #FreeTibet #HumanRights https://t.co/dFYZvXbAwD
Hoàng,"China violently suppressed the 1959 uprising, forcing the Dalai Lama into exile and scattering Tibetans worldwide. The world must still challenge Beijing’s occupation.\n#FreeTibet #StandWithTibet #StopChina #HumanRights https://t.co/XxQuWpyMhN"
